{
  "transition_types_lock_version": 1,
  "generated_at": "2026-01-05T01:55:51Z",
  "source": {
    "registry_path": "registries/transition-types.yaml",
    "registry_sha256": "4fe1a1fac1837ba19fbaa1e4adf26175a4b02f2e0a73813907578ad36a5f2a2d"
  },
  "snapshot": {
    "tag": "mez.transition-types.registry.snapshot.v1",
    "registry_version": 1,
    "transition_types": [
      {
        "kind": "generic"
      },
      {
        "kind": "mez.example.transfer.v1",
        "schema_digest_sha256": "28249476f011e934f7615a506a37f1e4bf9ba634b4e335194460d6a6296b9efa",
        "ruleset_digest_sha256": "c4510fbe06b7f778cf34a846ea5fcb777ac78143a1257b47ce119a7bd161fda4"
      },
      {
        "kind": "noop"
      },
      {
        "kind": "settle.swift.pacs008.v1",
        "schema_digest_sha256": "561cdd316d2a02968ab82ba442deeff747cf0ddd7b5c4289c93dae8f66abcd10",
        "ruleset_digest_sha256": "683cd1dc6191d0cd2ce347360cf4dfccdba393dfa56d2da6f098dbce46a45ff6"
      },
      {
        "kind": "settle.usdc.circle.transfer.v1",
        "schema_digest_sha256": "f9288e6e045e9ac5388ee387e53a70662c959604ae7d2731756ca4a9fd4438b6",
        "ruleset_digest_sha256": "00731932e9ba546adbafab373b4fbf5c72e0e386c4ad010ddff289ba8a976b2a"
      }
    ]
  },
  "snapshot_digest_sha256": "4adef5c65fb775ef5a06ee59b0d3e29a6eea0c48d5c760d0c67b6d4a096071ee"
}
